{
  "rule_id": "MA-CDTM-AGREEMENT-CUSTODY",
  "content_version": 1,
  "content_hash": "296698ea892b6c51b4f5137de21e5c7e96775fea01614599b3f84f8641d100e0",
  "title": "Copy with the pharmacist, original with the physician",
  "jurisdiction": "MA",
  "area": 2,
  "topic": "Collaborative practice",
  "subtopic": "Custody of the agreement",
  "rule_summary": "An authorized pharmacist must maintain a COPY of the current CDTM agreement, INCLUDING COPIES of the current patient referral and patient consent, IN THE PRIMARY PRACTICE SETTING, readily retrievable at the request of the Board of Registration in Pharmacy AND the Board of Registration in Medicine. In accordance with 243 CMR 2.12 the supervising physician must maintain the ORIGINAL of the current agreement, including the original current referral and consent, IN THE PATIENT'S MEDICAL RECORD in the custody of the supervising physician.",
  "exam_relevance": "Tests the custody split and the two-board retrievability requirement, both of which candidates commonly reduce to keeping the signed agreement somewhere.",
  "authority": [
    {
      "type": "PROMULGATED_REGULATION",
      "name": "Massachusetts Board of Registration in Pharmacy regulations",
      "section": "247 CMR 16.04(6)",
      "url": "https://www.mass.gov/regulations/247-CMR-1600-collaborative-drug-therapy-management"
    },
    {
      "type": "PROMULGATED_REGULATION",
      "name": "Massachusetts Board of Registration in Medicine regulations",
      "section": "243 CMR 2.12",
      "url": "https://www.mass.gov/regulations/243-CMR-200-licensing-and-the-practice-of-medicine"
    }
  ],
  "status": "CURRENT",
  "effective_date": null,
  "supersedes": [],
  "last_verified": "2026-08-20",
  "numeric_facts": [],
  "exceptions": [],
  "common_confusions": [
    "Holding the original on site and treating that as compliance",
    "Holding the agreement without the referral and consent copies",
    "Assuming retrievability to the Board of Registration in Pharmacy alone is enough"
  ],
  "related_rule_ids": [
    "MA-CDTM-CE-EVIDENCE"
  ],
  "verification_status": "PRIMARY_VERIFIED",
  "verification_notes": "Read verbatim in the current official publication on 2026-08-20 during Batch 3 tranche B3-C authoring under Issue #91. A fresh independent legal and full-bank realism audit is still required before release."
}
