{
  "rule_id": "FED-CII-EMERGENCY-DEFINITION",
  "title": "What counts as an emergency situation under federal law",
  "jurisdiction": "FEDERAL",
  "area": 3,
  "topic": "Controlled prescriptions",
  "subtopic": "Emergency situation definition",
  "rule_summary": "Under 21 CFR 290.10, for the purpose of authorizing an ORAL prescription of a Schedule II controlled substance, an EMERGENCY SITUATION means those situations in which the prescribing practitioner determines: (a) that IMMEDIATE ADMINISTRATION of the controlled substance is necessary for proper treatment of the intended ultimate user; AND (b) that NO APPROPRIATE ALTERNATIVE TREATMENT IS AVAILABLE, including administration of a drug which is not a Schedule II controlled substance; AND (c) that it is NOT REASONABLY POSSIBLE for the prescribing practitioner to provide a WRITTEN prescription to be presented to the person dispensing the substance prior to the dispensing. All three elements are the prescribing practitioner's determination.",
  "exam_relevance": "Tests the gate that must be satisfied before the emergency oral pathway opens at all, and in particular the no-alternative-treatment element that the Massachusetts definition does not carry.",
  "authority": [
    {
      "type": "FEDERAL_REGULATION",
      "name": "Definition of emergency situation",
      "section": "21 CFR 290.10(a), (b), (c)",
      "url": "https://www.ecfr.gov/current/title-21/chapter-I/subchapter-A/part-290/section-290.10"
    }
  ],
  "numeric_facts": [],
  "exceptions": [
    "The three elements are conjunctive; failing any one means the situation is not an emergency situation for this purpose."
  ],
  "common_confusions": [
    "Omitting the no-appropriate-alternative-treatment element, which federal law requires and Massachusetts does not state.",
    "Reading element (c) as impossibility of an ELECTRONIC prescription; the federal element is keyed to a WRITTEN prescription.",
    "Treating the determination as the pharmacist's; all three elements are determined by the prescribing practitioner."
  ],
  "related_rule_ids": [
    "FED-CII-EMERGENCY-ORAL",
    "MA-EMERGENCY-SITUATION-EXCEPTION"
  ],
  "verification_notes": "21 CFR 290.10 read verbatim in the current eCFR text on 2026-09-10. Added because the GPT-FRESH-B4-SG-REPAIR-V6A audit found SG-CII-EMERGENCY-ORAL promised the conditions of the pathway in its learning objectives while conveying neither sovereign's definition. Independent audit still required.",
  "content_version": 1,
  "content_hash": "734f7aab06a5af2591cafeb354d1a2c9ed261e9dd49b417350c45fb6a046163a",
  "status": "CURRENT",
  "effective_date": null,
  "supersedes": [],
  "last_verified": "2026-09-10",
  "verification_status": "PRIMARY_VERIFIED"
}
