{
  "rule_id": "MA-SERIOUS-EVENT-RECORDS",
  "content_version": 1,
  "content_hash": "fda118e116c281ccbdad23a2fdae43165b5ee63d5d6b4ac49604d44fcd32d775",
  "title": "Retention of serious-event reporting records",
  "jurisdiction": "MA",
  "area": 4,
  "topic": "Mandatory reporting",
  "subtopic": "Record retention",
  "rule_summary": "A pharmacy must retain readily retrievable records relating to reportable improper dispensing and serious adverse drug events for at least five years from filing the report.",
  "exam_relevance": "Tests whether the candidate can apply record retention requirements to a pharmacy-practice scenario without substituting a nearby rule.",
  "authority": [
    {
      "type": "PROMULGATED_REGULATION",
      "name": "Retention of serious-event reporting records",
      "section": "247 CMR 20.02(4)",
      "url": "https://www.mass.gov/doc/247-cmr-20-reporting/download"
    }
  ],
  "status": "CURRENT",
  "effective_date": null,
  "supersedes": [],
  "last_verified": "2026-08-13",
  "numeric_facts": [],
  "exceptions": [
    "Apply any narrower setting-specific, product-specific, or emergency exception before the general rule."
  ],
  "common_confusions": [
    "Confusing record retention with a nearby rule that has a different trigger or deadline."
  ],
  "related_rule_ids": [],
  "verification_status": "PRIMARY_VERIFIED",
  "verification_notes": "Current official source checked on 2026-08-13."
}
