{
  "rule_id": "MA-USP-797-HOLD",
  "content_version": 1,
  "content_hash": "d1a2efa44f63b53727b76bea023b3de85e3e51d9d0009199ec25444d2a175a68",
  "title": "Sterile compounding details pending source reconciliation",
  "jurisdiction": "MA",
  "area": 4,
  "topic": "Compounding",
  "subtopic": "USP 797",
  "rule_summary": "Exact sterile-compounding environmental and beyond-use-date details remain on hold pending licensed access to current USP text and final promulgated Massachusetts rules.",
  "exam_relevance": "Tests whether the candidate can apply usp 797 requirements to a pharmacy-practice scenario without substituting a nearby rule.",
  "authority": [
    {
      "type": "PROMULGATED_REGULATION",
      "name": "Sterile compounding details pending source reconciliation",
      "section": "247 CMR 9.01(3) and current USP <797>",
      "url": "https://www.mass.gov/doc/247-cmr-9-professional-practice-standards/download"
    }
  ],
  "status": "UNCLEAR",
  "effective_date": null,
  "supersedes": [],
  "last_verified": "2026-08-13",
  "numeric_facts": [],
  "exceptions": [
    "Apply any narrower setting-specific, product-specific, or emergency exception before the general rule."
  ],
  "common_confusions": [
    "Confusing usp 797 with a nearby rule that has a different trigger or deadline."
  ],
  "related_rule_ids": [],
  "verification_status": "HOLD",
  "verification_notes": "HOLD: authoritative sources are not yet reconciled; no question may cite this rule."
}
