{
  "rule_id": "MA-LICENSEE-CHANGE-14D",
  "content_version": 1,
  "content_hash": "4927d93e63c5e3629f7b14e715a6af553f037b52d64c0e3d9dc2a36236973b5c",
  "title": "Licensee demographic and status reporting",
  "jurisdiction": "MA",
  "area": 1,
  "topic": "Licensure",
  "subtopic": "Change reporting",
  "rule_summary": "Board licensees must update specified contact information and report specified name, criminal, disciplinary, or certification events within the applicable 14-day reporting period.",
  "exam_relevance": "Tests whether the candidate can apply change reporting requirements to a pharmacy-practice scenario without substituting a nearby rule.",
  "authority": [
    {
      "type": "PROMULGATED_REGULATION",
      "name": "Licensee demographic and status reporting",
      "section": "247 CMR 20.03",
      "url": "https://www.mass.gov/doc/247-cmr-20-reporting/download"
    }
  ],
  "status": "CURRENT",
  "effective_date": null,
  "supersedes": [],
  "last_verified": "2026-08-13",
  "numeric_facts": [],
  "exceptions": [
    "Apply any narrower setting-specific, product-specific, or emergency exception before the general rule."
  ],
  "common_confusions": [
    "Confusing change reporting with a nearby rule that has a different trigger or deadline."
  ],
  "related_rule_ids": [],
  "verification_status": "PRIMARY_VERIFIED",
  "verification_notes": "Current official source checked on 2026-08-13."
}
