{
  "rule_id": "MA-CDTM-IMMEDIATE-TREATMENT-SUPPLY",
  "content_version": 1,
  "content_hash": "334624bd1020cfd0793028ac6df798ff0242fe862f41f078a2a97f677ebfd072",
  "title": "Procurement channel for immediate-treatment stock turns on the schedule",
  "jurisdiction": "MA",
  "area": 2,
  "topic": "Collaborative practice",
  "subtopic": "Supply for immediate treatment",
  "rule_summary": "The pharmacist may dispense a controlled substance for immediate treatment in accordance with M.G.L. c. 94C, s. 9, PROVIDED the pharmacist is authorized by 105 CMR 700.003(G) to prescribe that substance. The pharmacist may order from a drug wholesaler, manufacturer, laboratory or distributor, for purposes of dispensing for immediate treatment, those controlled substances IN SCHEDULE VI which the pharmacist is authorized to prescribe. For Schedules II through V dispensed for immediate treatment, the pharmacist may obtain such controlled substances ONLY as supplied by the supervising physician or obtained through a prescription or medication order for the patient.",
  "exam_relevance": "Tests that the schedule decides the lawful procurement channel, and that ordinary wholesaler purchasing is closed for Schedules II through V in this pathway.",
  "authority": [
    {
      "type": "PROMULGATED_REGULATION",
      "name": "Massachusetts Department of Public Health regulations",
      "section": "105 CMR 700.003(G)(5) and (G)(6)",
      "url": "https://www.mass.gov/regulations/105-CMR-70000-implementation-of-mgl-c94c"
    }
  ],
  "status": "CURRENT",
  "effective_date": null,
  "supersedes": [],
  "last_verified": "2026-08-20",
  "numeric_facts": [],
  "exceptions": [],
  "common_confusions": [
    "Assuming a pharmacy that may buy a product for dispensing may buy it for this purpose",
    "Overlooking the precondition that the pharmacist must be authorised to prescribe it",
    "Treating the supervising physician's supply route as available for Schedule VI only"
  ],
  "related_rule_ids": [
    "MA-CDTM-PRESCRIBING-POWERS"
  ],
  "verification_status": "PRIMARY_VERIFIED",
  "verification_notes": "Read verbatim in the current official publication on 2026-08-20 during Batch 3 tranche B3-D authoring under Issue #91. A fresh independent legal and full-bank realism audit is still required before release."
}
