{
  "rule_id": "FED-CENTRAL-FILL-DEFINITION-AND-REGISTRATION",
  "content_version": 1,
  "content_hash": "bb3f07913301b8683b63777be6528b1d77783a62cc8f069af25f30454da9e4dd",
  "title": "Federal central fill pharmacy: definition, authorization, registration and who may fill",
  "jurisdiction": "FEDERAL",
  "area": 4,
  "topic": "Shared pharmacy services",
  "subtopic": "DEA central fill definition and registration",
  "rule_summary": "Under 21 CFR 1300.01 a central fill pharmacy means a pharmacy which is permitted by the state in which it is located to prepare controlled substances orders for dispensing pursuant to a valid prescription transmitted to it by a registered retail pharmacy and to return the labeled and filled prescriptions to the retail pharmacy for delivery to the ultimate user; it is deemed authorized to fill prescriptions on behalf of a retail pharmacy only if the retail pharmacy and central fill pharmacy have a contractual relationship providing for such activities or share a common owner. The registration table in 21 CFR 1301.13(e)(1) places Central Fill Pharmacy within the dispensing or instructing business activity for Schedules II-V and states that a retail pharmacy may perform central fill pharmacy activities. Under 21 CFR 1306.06 a prescription for a controlled substance may only be filled by a pharmacist acting in the usual course of professional practice and either registered individually or employed in a registered pharmacy, a registered central fill pharmacy, or a registered institutional practitioner, and under 21 CFR 1306.05(f) the corresponding liability for filling a prescription not prepared in the form DEA regulations prescribe rests on the pharmacist, including a pharmacist employed by a central fill pharmacy. Under 21 CFR 1305.03(d) delivery from a central fill pharmacy to a retail pharmacy does not require a DEA Form 222 or electronic order, and under 21 CFR 1306.26(g) central fill pharmacies may not dispense controlled substances to a purchaser at retail under that section.",
  "exam_relevance": "Tests the federal frame a Massachusetts pharmacy relies on when a central fill pharmacy prepares its controlled-substance prescriptions: state permission, a contract or common owner, DEA registration, and return of the filled prescription to the retail pharmacy.",
  "authority": [
    {
      "type": "FEDERAL_REGULATION",
      "name": "Definitions",
      "section": "21 CFR 1300.01, definition of Central fill pharmacy",
      "url": "https://www.ecfr.gov/current/title-21/section-1300.01"
    },
    {
      "type": "FEDERAL_REGULATION",
      "name": "Registration of manufacturers, distributors and dispensers",
      "section": "21 CFR 1301.13(e)(1), dispensing or instructing activity",
      "url": "https://www.ecfr.gov/current/title-21/chapter-II/part-1301/section-1301.13"
    },
    {
      "type": "FEDERAL_REGULATION",
      "name": "Purpose of issue of prescription; persons entitled to fill prescriptions",
      "section": "21 CFR 1306.05(f); 21 CFR 1306.06",
      "url": "https://www.ecfr.gov/current/title-21/chapter-II/part-1306/section-1306.06"
    },
    {
      "type": "FEDERAL_REGULATION",
      "name": "Distributions requiring a Form 222 or a digitally signed electronic order; dispensing without prescription",
      "section": "21 CFR 1305.03(d); 21 CFR 1306.26(g)",
      "url": "https://www.ecfr.gov/current/title-21/chapter-II/part-1305/section-1305.03"
    }
  ],
  "status": "CURRENT",
  "effective_date": null,
  "supersedes": [],
  "last_verified": "2026-09-17",
  "numeric_facts": [],
  "exceptions": [],
  "common_confusions": [
    "Federally the filled prescription returns to the retail pharmacy for delivery to the ultimate user; the definition does not describe the central fill pharmacy delivering to the patient.",
    "A central fill pharmacy is authorized to fill for a retail pharmacy only through a contractual relationship or a common owner."
  ],
  "related_rule_ids": [
    "FED-CENTRAL-FILL-TRANSMISSION-RECORDS",
    "FED-CENTRAL-FILL-LABEL-AND-PARTNER-RECORDS"
  ],
  "verification_status": "PRIMARY_VERIFIED",
  "verification_notes": "Read on 2026-09-17 in the eCFR (Title 21 up to date as of 9/15/2026): 21 CFR 1300.01, 1301.13(e)(1), 1305.03(d), 1306.05(f), 1306.06 and 1306.26(g)."
}
