{
  "rule_id": "FED-CII-EMERGENCY-FOLLOWUP",
  "content_version": 1,
  "content_hash": "d659cf088b81393781674d30fe0dc73f13b6cae1c805353d524d8fc692cb41fe",
  "title": "Follow-up after emergency oral Schedule II dispensing",
  "jurisdiction": "FEDERAL",
  "area": 3,
  "topic": "Controlled prescriptions",
  "subtopic": "Emergency follow-up",
  "rule_summary": "The prescriber must deliver the required written or electronic follow-up Schedule II prescription to the pharmacy within seven days after authorizing emergency oral dispensing.",
  "exam_relevance": "Tests whether the candidate can apply emergency follow-up requirements to a pharmacy-practice scenario without substituting a nearby rule.",
  "authority": [
    {
      "type": "FEDERAL_REGULATION",
      "name": "Follow-up after emergency oral Schedule II dispensing",
      "section": "21 CFR 1306.11(d)(4)",
      "url": "https://www.ecfr.gov/current/title-21/chapter-II/part-1306/section-1306.11"
    }
  ],
  "status": "CURRENT",
  "effective_date": null,
  "supersedes": [],
  "last_verified": "2026-08-13",
  "numeric_facts": [],
  "exceptions": [
    "Apply any narrower setting-specific, product-specific, or emergency exception before the general rule."
  ],
  "common_confusions": [
    "Confusing emergency follow-up with a nearby rule that has a different trigger or deadline."
  ],
  "related_rule_ids": [],
  "verification_status": "PRIMARY_VERIFIED",
  "verification_notes": "Current official source checked on 2026-08-13."
}
