{
  "rule_id": "MA-LICENSEE-AIDING-UNLAWFUL-PRACTICE-BAR",
  "content_version": 1,
  "content_hash": "8f1cb0d8c4e66a4cd8bcef2a177a70d2c680b339eb01556fe97c30382b69ac17",
  "title": "A licensee may not in any way aid or abet the unlawful practice of pharmacy",
  "jurisdiction": "MA",
  "area": 2,
  "topic": "Professional conduct",
  "subtopic": "Aiding or abetting unlawful practice",
  "rule_summary": "Under 247 CMR 9.01(10), a licensee may not in any way aid or abet the unlawful practice of pharmacy.",
  "exam_relevance": "Tests the prohibition on aiding or abetting, in any way, the unlawful practice of pharmacy.",
  "authority": [
    {
      "type": "PROMULGATED_REGULATION",
      "name": "Massachusetts Board of Registration in Pharmacy regulations",
      "section": "247 CMR 9.01(10)",
      "url": "https://www.mass.gov/doc/247-cmr-9-professional-practice-standards/download"
    }
  ],
  "status": "CURRENT",
  "effective_date": null,
  "supersedes": [],
  "last_verified": "2026-09-16",
  "numeric_facts": [],
  "exceptions": [],
  "common_confusions": [
    "247 CMR 9.01(10) does not define the unlawful practice of pharmacy."
  ],
  "related_rule_ids": [],
  "verification_status": "PRIMARY_VERIFIED",
  "verification_notes": "Read on 2026-09-16 in the Board of Registration in Pharmacy's publication of 247 CMR 9.00 on mass.gov (PDF, Mass. Register #1536, 12/6/2024)."
}
