{
  "rule_id": "MA-TECH-LICENSE-ELIGIBILITY",
  "content_version": 1,
  "content_hash": "08bf9abe5831ad7dc3288bbfcfdfa0c2d0e5d50890ad1ef0f64550c51d617027",
  "title": "Pharmacy technician licensure eligibility pathways",
  "jurisdiction": "MA",
  "area": 1,
  "topic": "Pharmacy personnel",
  "subtopic": "Technician licensure eligibility",
  "rule_summary": "Under 247 CMR 8.02(3) an applicant for a pharmacy technician license shall be at least 18 years old, a high school graduate or equivalent or currently enrolled in such a program, of good moral character, not convicted of a drug-related felony or having admitted to sufficient facts to warrant such a finding, and shall satisfy one of three alternatives: hold certification from a Board-approved certifying body; hold a substantially equivalent technician license in good standing in another state; or achieve a Board-approved passing score on a Board-approved assessment examination after completing either a Board-approved training program or a minimum of 500 hours of employment as a pharmacy technician trainee attested under the pains and penalties of perjury and witnessed by the employer.",
  "exam_relevance": "Tests that the three eligibility routes are alternatives rather than cumulative requirements, and that the examination route itself has a prerequisite.",
  "authority": [
    {
      "type": "PROMULGATED_REGULATION",
      "name": "Massachusetts Board of Registration in Pharmacy regulations",
      "section": "247 CMR 8.02(3)",
      "url": "https://www.mass.gov/regulations/247-CMR-800-pharmacy-interns-and-technicians"
    }
  ],
  "status": "CURRENT",
  "effective_date": null,
  "supersedes": [],
  "last_verified": "2026-08-19",
  "numeric_facts": [
    {
      "fact": "minimum technician age",
      "value": 18,
      "unit": "years",
      "conditions": "at application"
    },
    {
      "fact": "trainee hours supporting the examination route",
      "value": 500,
      "unit": "hours",
      "conditions": "attested under the pains and penalties of perjury and witnessed by the employer"
    }
  ],
  "exceptions": [],
  "common_confusions": [
    "The three routes are alternatives; certification is not required if another route is satisfied.",
    "The assessment examination is not a standalone route; it follows training or 500 trainee hours."
  ],
  "related_rule_ids": [
    "MA-TECH-TRAINEE-LIMITS",
    "MA-TECH-LICENSE-RENEWAL"
  ],
  "verification_status": "PRIMARY_VERIFIED",
  "verification_notes": "Read in the current official Board of Registration in Pharmacy publication of 247 CMR 8.00 on 2026-08-19 during Batch 3 tranche B3-A authoring under Issue #91. A fresh independent legal and full-bank realism audit is still required before release."
}
