{
  "rule_id": "MA-RX-TRANSFER",
  "content_version": 2,
  "content_hash": "1a99c508dbc423f1c72889b80be41940b080066ded97c11d67c7b623351517bf",
  "title": "Massachusetts transfer of prescriptions",
  "jurisdiction": "MA",
  "area": 3,
  "topic": "Prescription transfer",
  "subtopic": "Transfer requirements",
  "rule_summary": "Under current 247 CMR 9.14, a pharmacy must timely transfer a prescription at the request of the patient or authorized agent, may act as the patient's agent to obtain the transfer, and may not charge a transfer fee. Schedule VI prescriptions transfer in the same manner as Schedule III-V prescriptions; remaining authorized refills may be transferred, but a Schedule VI prescription may not be transferred more than one year after issuance. Under 247 CMR 8.04, a certified pharmacy technician may perform a Schedule VI transfer with approval of the pharmacist on duty.",
  "exam_relevance": "Tests transfer timing, Schedule VI age/refill limits, no-fee requirements, and the certified-technician Schedule VI transfer role without importing stale pharmacist-only mechanics.",
  "authority": [
    {
      "type": "PROMULGATED_REGULATION",
      "name": "Massachusetts transfer of prescriptions",
      "section": "247 CMR 9.14",
      "url": "https://www.mass.gov/doc/247-cmr-9-professional-practice-standards/download"
    },
    {
      "type": "PROMULGATED_REGULATION",
      "name": "Certified pharmacy technician Schedule VI transfer scope",
      "section": "247 CMR 8.04(4)(d)",
      "url": "https://www.mass.gov/doc/247-cmr-8-pharmacy-interns-and-technicians/download"
    }
  ],
  "status": "CURRENT",
  "effective_date": null,
  "supersedes": [],
  "last_verified": "2026-08-14",
  "numeric_facts": [
    {
      "fact": "Schedule VI maximum age for transfer",
      "value": 1,
      "unit": "year from issuance",
      "conditions": "No Schedule VI prescription may be transferred more than one year after it was issued."
    }
  ],
  "exceptions": [
    "Schedule-specific federal requirements may add restrictions for federally controlled prescriptions; do not automatically import those mechanics into a Massachusetts Schedule VI transfer."
  ],
  "common_confusions": [
    "Using obsolete pharmacist-to-pharmacist or annotation language as the universal current Massachusetts transfer rule.",
    "Assuming a certified pharmacy technician can never perform a Schedule VI transfer.",
    "Applying a six-month cutoff instead of the current one-year Schedule VI transfer limit."
  ],
  "related_rule_ids": [],
  "verification_status": "PRIMARY_VERIFIED",
  "verification_notes": "Current 247 CMR 9.14 and 247 CMR 8.04 checked on 2026-08-14; v2 removes stale universal pharmacist-to-pharmacist/annotation summary language."
}
