{
  "rule_id": "MA-RX-LARGE-PRINT-DIRECTIONS",
  "content_version": 1,
  "content_hash": "ec3209d3f2f141cea88e3925035d52342e7cab6486b0cd341c3e8e0e0875c3b2",
  "title": "Ten characters per inch on request for an elderly or visually impaired person",
  "jurisdiction": "MA",
  "area": 3,
  "topic": "Dispensing requirements",
  "subtopic": "Accessible label directions",
  "rule_summary": "UPON THE REQUEST of an elderly person, as defined in M.G.L. c. 19A, s. 14, or of a person who is VISUALLY IMPAIRED, the directions on the label affixed by the pharmacist to a container of a prescription drug shall be TYPED IN A PRINT SIZE ALLOWING NO MORE THAN TEN CHARACTERS PER INCH. The duty is triggered by the request, and the standard is expressed as a maximum character density rather than a point size.",
  "exam_relevance": "Tests a request-triggered accessibility duty with a specific measurable standard, which no other bank question reaches.",
  "authority": [
    {
      "type": "STATUTE",
      "name": "Massachusetts General Laws",
      "section": "M.G.L. c. 94C, s. 21, second paragraph",
      "url": "https://malegislature.gov/Laws/GeneralLaws/PartI/TitleXV/Chapter94C/Section21"
    }
  ],
  "status": "CURRENT",
  "effective_date": null,
  "supersedes": [],
  "last_verified": "2026-08-20",
  "numeric_facts": [
    {
      "fact": "Maximum print density for directions on request",
      "value": 10,
      "unit": "characters per inch",
      "conditions": "elderly or visually impaired person, upon request"
    }
  ],
  "exceptions": [],
  "common_confusions": [
    "Treating the duty as automatic for anyone who appears elderly",
    "Reading the standard as a minimum rather than a maximum character density",
    "Assuming it reaches the whole label rather than the directions"
  ],
  "related_rule_ids": [
    "MA-CS-LABEL"
  ],
  "verification_status": "PRIMARY_VERIFIED",
  "verification_notes": "Read verbatim in the current official publication on 2026-08-20 during the Batch 3 tranche B3-E v2 expansion under Issue #91. A fresh independent legal and full-bank realism audit is still required before release."
}
